{
  "id": "expert-private-contributor-monkey-shoulder-the-original",
  "type": "tasting",
  "version": "1.0",
  "contributor": {
    "name": "Private Contributor",
    "tier": "expert",
    "source_platform": "manual"
  },
  "dates": {
    "post_date": null,
    "tasted_date": null,
    "note": "Private tasting"
  },
  "whisky": {
    "name_display": "Monkey Shoulder â€“ The Original",
    "category": "blended-malt-scotch",
    "style": "neat",
    "region": "Scotland",
    "distillery": null,
    "brand_or_label": "Monkey Shoulder",
    "series": null,
    "age_years": null,
    "abv_percent": 40,
    "cask_type": null,
    "cask_number": null,
    "bottle_count": null,
    "bottling_notes_label": null
  },
  "tasting": {
    "summary": "A straightforward and honest blended malt. No pretensions, but well put together.",
    "notes": {
      "nose": [
        "Clean and calm.",
        "Vanilla, malt, a touch of honey.",
        "Apple and pear in the background, no sharp edges."
      ],
      "palate": [
        "Soft and rounded.",
        "Malt sweetness, vanilla, light caramel.",
        "Easy to drink, smooth, without tension."
      ],
      "finish": [
        "Short and warm.",
        "Malt and vanilla fade quietly."
      ],
      "overall": [
        "A straightforward and honest blended malt.",
        "No pretensions, but well put together.",
        "Would buy again: Yes."
      ]
    },
    "score": null,
    "comparisons": []
  },
  "context": null,
  "source": {
    "platform": "manual",
    "post_url": null,
    "original_text": "public/sources/manual/private-contributor/monkey-shoulder-the-original/notes.txt",
    "assets": [
      {
        "kind": "image",
        "path": "/sources/manual/private-contributor/monkey-shoulder-the-original/image.jpg",
        "note": "Bottle photograph"
      }
    ],
    "permission": {
      "status": "approved",
      "note": "Supplied directly by contributor (private tasting)"
    }
  },
  "tags": [
    "expert",
    "manual",
    "private-tasting"
  ]
}
